<!-- a response will indicate when the student has not completed the survey yet -->
<!ELEMENT Responses (Student*)>
<!ELEMENT Student (Answer*)>
<!ELEMENT Answer (#PCDATA)>

<!ATTLIST Student ID ID #REQUIRED>